Type,Cleaned_content
neutral,group net sale third quarter 2007 total eur 1423 mn oper profit eur 43 mn
neutral,gs engin instal valv liquefi natur ga lng plant built uae lng extract ga plant oper gasco ruwai uae
neutral,guangdong octob 26 sinocast nokia telecommun dongguan branch enter letter intent open nokia class qingyuan polytechn qingyuan citi guangdong provinc
neutral,join technopoli kone held variou posit within group recent director servic busi busi develop kone middl eastern oper
neutral,high wind also toppl three semitrail i15 north barstow
neutral,hk ruokatalo target know consum
neutral,honkarakenn custom project one biggest real estat compani kazakhstan accord compani
neutral,howev product almost entir labor intens base small invest
positive,2006 compani intend invest significantli expand distribut mainten network
neutral,2007 etteplan turnov eur125 2
neutral,2007 group net sale stood eur 42 million 1445 employe
neutral,2007 etteplan report turnov eur125 2
neutral,2008 avc systemhau net sale eur 10 million usd 71
neutral,2008 stockmann earn 3398 million lat profit 48012 million lat turnov
neutral,2010 sanoma magazin expect net sale 2009 level
neutral,addit compani consid start product russia
negative,addit compani reduc maximum ten job
neutral,addit kazakh deleg visit finland sitra invest fund honkarakenn ltd nokia headquart studi teliasonera ltd jsc activ
neutral,addit stake megafon telecominvest current own 100 share web plu st petersburg payphon 51 telecom equip produc peterservi number minor asset
positive,addit russia seek addit growth ukrain
neutral,addit softwar develop new design unit provid mechan engin electron design
neutral,addit verif ident digit signatur new stateapprov mobil id enabl cast vote elect well
neutral,april 2010 olvi rang cider expand strawberryrhubarb applepear cider green bottl new shape
neutral,apriljun 2008 scanfil net sale total eur 587 mn oper profit eur 66 mn
positive,bank sampo unchang 1424 eur nordea rose 042 pct 951 eur
neutral,finland alma media focu qualiti develop chain oper
neutral,finland five largest brand control 90 beer market
negative,finland finnish pharmaceut compani orion corpor omx helsinki ornav said wednesday 7 januari conclud personnel negoti finland reduc number personnel 205
neutral,juli quadriga capit sold lewa gmbh pumpmak busi japan nikkiso co
neutral,novemb finnish govern decreas ownership compani 311 percent 38 percent
neutral,sweden agreement cover data commun servic well
neutral,automobil space maruti search brand car
positive,autumn plan expand servic st petersburg moscow launch servic yekaterinburg russia fli three time week
neutral,begin negoti estim number reduct 50 maximum
neutral,czech republ profil unit ostrava close machineri reloc ruukki bigger plant hungari poland romania end first quarter 2009
neutral,czech republ smaller profil unit ostrava close machineri gradual reloc ruukki bigger plant hungari poland romania end first quarter 2009
neutral,first quarter 2008 sacanfil net sale total eur 500 mn oper profit eur 47 mn
neutral,third quarter 2007 net sale total eur 2595 mn oper profit eur 388 mn
neutral,incap contract manufactur servic pvt ltd subsidiari incap corpor finland acquir manufactur unit tv electron ltd tumkur near bangalor rs40 crore
neutral,inha work invest product develop market research
neutral,come complet lcd touch screen system select chosen function price start around pound 4805 mark
neutral,grew finland norway denmark baltic countri
neutral,includ option addit 30 commun build site well construct supervis work construct site
neutral,develop symbian softwar licens consortium led nokia
neutral,estim consolid turnov kausta guder reach lt 53mn us 2253 mn eur 1535 mn 2007
neutral,first applic market invoic purchas requisit approv mobil devic
neutral,own 80565 share amer sport corpor equal 011 compani share capit vote right
neutral,post turnov 45 mln euro 61 mln oper profit 15 mln euro 20 mln 2006
neutral,ixono financ acquisit 38 mln euro 52 mln loan
neutral,jrvisuomen portti also plan reduc use sodium nitrit
neutral,karachi sept 14 ixono world leader develop integr solut handheld devic announc implement touch screen mobil user interfac solut intel atom processor z6xx base smartphon
neutral,kaukotelko central administr dissolv appropri part transfer oper activ group administr end year
neutral,kemira rd organ compris approxim 750 peopl compani said
negative,konecran previous commun estim reduct 1600 employe group level 2009
neutral,lt also acquir 50 pct stake local sector compani salvor oy begin septemb 2007
neutral,laavainen said benecol well known europ us market 15 year
neutral,latin america current account approxim 40 sale tecnotre compani presid ceo eero mertano recent told bnamerica
positive,latvenergo order signific expans tekla xpower network inform system
neutral,lc servic cover whole life cycl softwar inform system process model tailor softwar develop host servic solut manag mainten support
positive,lemcon also sign precontract purchas park entir 130hectar site
neutral,lieksaar oy earlier regard control saarelainen oy individu sharehold sharehold agreement
neutral,liquid handl product includ electron mechan pipett dispos tip well pipett mainten calibr servic research institut healthcar industri laboratori
neutral,adp new jan 13 2009 finnish industri environment measur equip maker vaisala oyj omx vaia said yesterday develop oper refer radiosond climat chang observ
neutral,adpnew dec 23 2009 norwegian financi servic group sparebank 1 gruppen osl sbgrp said board director appoint today jarl haug manag director claim collect subsidiari sparebank 1 gruppen finan
neutral,mkel demand new board compani well discuss merger alma media media compani talentum
neutral,marathon estim valu remain stake protalix 27 million
neutral,margin call zanadvorov given chanc make purchas credit deutsch bank usd 560 million
neutral,marimekko consid measur matter
neutral,market use tikkurila exist infra structur local knowledg russia
neutral,metsaliitto sell 11 million b share neomarkka account 183 pct neomarkka equiti 127 pct vote right
neutral,moreov konecran kito intend transfer hoist distribut busi konecran japanes joint ventur mh konecran kito
neutral,growth beer consumpt took place far east latin america africa
neutral,new substat support edg technolog enabl faster data traffic
neutral,raw materi come europ us paid euro us dollar sale take place rubl
neutral,recent found virent energi system inc 80 person catalyt biofuel compani presid ceo led compani multipl financ defin compani market strategi secur compani first custom
neutral,motorola account 115 percent south korean handset market end april samsung held 55 percent lg electron 19 percent accord koreabas atla research group
neutral,motorola inc unit state came second shipment 2174 million unit 213 percent market share follow south korea samsung electron co shipment 1180 million unit 116 percent share
neutral,mr jortikka presid base metal divis outotec oyj finland execut committe outotec
neutral,mr kr vasantha appoint manag director incap contract manufactur servic pvt ltd
neutral,mr dore eaton sinc 1989 act busi unit manag eaton power control busi unit sinc januari 2007
neutral,mr koistinen join nokia siemen network held variou senior sale manag busi develop posit sinc 1997
neutral,mr mcdonald start even set featur hit solo career doobi brother year select rb cover song met mix result
neutral,mreal corpor stock exchang announc 29 septemb 2006 415 pm kyro corpor mreal corpor metsaliitto group subsidiari agre arrang give mreal option purchas kyroskoski natur ga powerpl kyro
neutral,mreal plan discontinu product standard coat fine paper hallein gohrsmhl mill
neutral,nest oil offer outplac servic 111 employe reduc
neutral,new corp myspacecom web site display submiss expand broadband emmi award part effort identifi aspir video artist
neutral,niam offer financi investor high return via invest fund turn invest type properti
neutral,chang regard virala oy ab ownership share tiimari taken place
neutral,financi detail deploy disclos
neutral,financi price detail disclos
neutral,plan close date provid
neutral,servic price detail disclos
neutral,nordea bank ab publ hold 6000 alma media share repres 0008 share capit vote right
neutral,nordea pankki suomi oyj ownership stonesoft corpor decreas 120
neutral,nordea coordin syndic loan
neutral,nordstjernan use option buy anoth 224 stake salcomp share vote
neutral,nviro oper process facil independ well partnership municip
neutral,okmet close plant espoo earli 2004 product line site move okmet plant vantaa finland texa usa
neutral,okmet global custom base sale network product plant finland us contract manufactur japan china
neutral,preliminari estim hotel oper brand novotel
neutral,one largest project magazin divis sanomawsoy sanoma magazin intern 2006 becam launch russian magazin gloriya
neutral,oper profit oper finland period review total eur 113 mn remain 2005 level
neutral,oppohjola group capit adequaci ratio act credit institut stood 121 tier 1 ratio 121
neutral,custom includ compani energi process industri sector particular
neutral,key geograph market europ russian feder middleeast southafrica japan
neutral,tool specif design need busi user ict expert mind
neutral,outotec deliveri cover engin suppli construct circul fluid bed calcin plant capac 1600 ton alumina per day
neutral,ova press 60 stake joint ventur imsm hold 40 stake
neutral,panostaja own 6877 pct share capit vote right suomen helasto share follow exchang share carri may 30 2007
neutral,panostaja plc today acquir entir share capit suomen graafiset palvelut ltd provid print servic
neutral,paper compani mreal calcul 100000 biscuit carton made use 25gsm lighter board co2 save cours 12 month would equal gener drive 1000 km car
negative,paper stock among biggest faller stora enso 230 pct 1401 eur mreal 286 pct 509 eur upmkymmen 114 pct lower 1910 eur
neutral,part reduct made retir arrang
neutral,payment acquir share made cash price per share eur 1 plu administr fee
neutral,pct lower 444210
neutral,pharmaceut market czech republ global research data servic publish recent market analysi pharmaceut market czech republ
neutral,pharmaceut market itali global research data servic publish recent market analysi pharmaceut market itali
neutral,pharmaceut market netherland global research data servic publish recent market analysi pharmaceut market netherland
neutral,previous project figur slightli lower 2009
neutral,previous compani expect 2008 financi perform remain level 2008
neutral,profit tax total eur 121 mn
neutral,qpr processguid avail system solut central storag manag process content well standalon desktop version qpr processguid xpress
neutral,quartal oy own 2094063 share satama interact plc repres 519 per cent share capit vote right
neutral,renesa mobil europ ltd approxim 470 employe oulu
neutral,rihko said sale enabl compani concentr grainbas busi
neutral,rihko start manag raisio benecol busi summer 2006 head tobacco compani altadi european oper
neutral,rim revamp blackberri os ui 60 version mobil oper system
neutral,rimi supermarket key custom magistr center
neutral,rimvesta control estonianown real estat develop compani ell nekilnojama turta member merko largest construct group baltic countri
neutral,risto rati tekla execut vice presid said tekla structur archicad cover entir design document workflow throughout construct project
neutral,rohwedd group automot suppli telecommun electron industri provid custom europ north america asia
neutral,rosa one bestknown duckburg illustr
neutral,rsa share close 1569 p time go press
neutral,rubin say expect capman announc 12 addit transact 2009
neutral,russia video intern group hold control stake russian media ventur
neutral,outokumpu technolog busi begin trade nordic exchang helsinki start oct 10 becom sixth compani list exchang year compani said friday
positive,salo finland 29 august 2006 benefon today announc plan strengthen inhous technolog platform licens complet mobil softwar platform opna longstand technolog partner pollex
neutral,sampo group becom major sharehold nordea own trygvesta main competitor p c insur
neutral,scanfil hold includ 100 contract electron manufactur scanfil em group
neutral,sinc registr share subscrib direct share issu new number panostaja share vote right 41733110
neutral,stora enso busi north america annual capac 3 million ton employ 4350 peopl
neutral,stora enso receiv 199 pct equiti interest combin compani
neutral,stora due releas fourthquart 2009 fullyear earn feb 4
neutral,storengi gdf suez compani dedic underground storag natur ga
positive,strand associ expand madison corpor headquart space add 100 employe engin firm
neutral,talentum acquir 475 pct stake varesvuo partner 1997 remain 2002 2005
neutral,technopoli st petersburg telecommun univers russian support fund legisl initi sign protocol intent may year set technopark st petersburg base st petersburg telecommun univers
neutral,technopoli finnish oper oulu vantaa espoo lappeenranta jyvaskyla tamper also prepar expand oper russia
neutral,technopoli set asid plot land measur 46 hectar build park mikkonen said
neutral,tekla group net sale 2006 approxim 50 million euro oper result 136 million euro
neutral,telest expect start deliveri end 2009
neutral,thank extens industri oper experi cybercom offer strateg technolog expertis market telecom industri media public sector retail bank financi servic
neutral,address also happen hous italian megamart eatali mean come kid go toy build
neutral,3c expo signatur show dongguan support dongguan municip govern everi year featur comput accessori softwar commun network product
neutral,acquir busi main asset mobil authent sign solut brand tectia mobileid provid authent web email sslvpn ms sharepoint tectia secur solut applic resourc
neutral,acquisit part ramir central eastern european growth strategi
positive,acquisit part ramir strategi strengthen posit select locat
neutral,agreement includ applic mainten support servic
neutral,agreement includ entir process manag mercat suppli chain region compani current present
neutral,america repres 25 gemalto bill latin america one fastest grow region compani
neutral,annual valu contract estim usd 2mn next three year
neutral,area also includ central build honkarakenn start negoti deliveri
neutral,bank also expect addit cost relat dash 8 q400 jet group shelv octob 2007
neutral,bank leas arm nordea liis end year profit 44 million euro
neutral,board establish remuner committe follow member sari baldauf chairman tapio hintikka heikki westerlund addit board decid appoint nomin committe later stage
neutral,bond matur five year part bank domest bond program
neutral,bridg part highway 14 develop project
neutral,build hous product develop test laboratori
neutral,busi area net sale slightli 2m 2006
neutral,busi develop initi north america head lynn shanahan
neutral,busi organis februari 1 2011 way product design servic combin one entiti etteplan oper
neutral,busi transfer take effect 1 januari 2007 connect 47 employe transfer elisa daxtum continu employe
neutral,center built kapuli district mantsala besid hankomantsalaporvoo road near new direct rail link lahti jarvenpaa
neutral,chang readership signific
neutral,close transact took place today
neutral,close transact schedul take place januari 10 2008
neutral,combin capit fund expect eur 100mn150mn
neutral,combin compani proforma net sale 140 mln euro 1889 mln oper profit 13 mln euro 175 mln 2006
neutral,commiss found evid sever meet discuss cartel includ one brussel restaur novemb 1997 compani discuss price increas
neutral,committe propos follow remuner monthli remuner eur 5000 chairman eur 3500 deputi chairman eur 2500 board member
neutral,compani divest upm fray bento pulp mill forest orient compani specialis eucalyptu cultiv
neutral,compani eur2 8 bn asset count among five largest sharehold finnish insur ilmarinen 434 varma 070 well finnish state pension fund ver 061
neutral,compani also equip sculptur complex rabochi kolkhoznitsa worker collect farmer moscow snow melt system
neutral,compani also said deploy danish 4g network continu expect cover 75 danish popul 2011
negative,compani decid end 2008 temporarili shut ammonia plant billingham extend mainten period inc facil
neutral,compani distribut dividend 2005
neutral,compani expect net sale whole 2009 previou year level
neutral,compani expect net sale whole 2007 eur 950mn1 000 mn
neutral,compani net sale eur 108 million 2008 today approxim 120 employe finland estonia poland
neutral,compani net sale eur 198 mn pretax profit eur 18 mn 2005
neutral,compani 120 employe annual sale approxim eur16m
neutral,compani annual turnov eur32 8
neutral,compani involv sale financi product includ insur mortgag car person loan financi brokerag equip financ leas
neutral,compani oper four princip divis consum packag offic paper special paper well market pulp energi
neutral,compani plan increas unit specialist staff sever dozen depend market situat 2010
neutral,compani report net sale 302 mln euro 4416 mln oper margin 16 pct 2006
neutral,compani set servic includ digit print print prepar offsetprint aftertreat servic send servic
neutral,compani transport busi conduct florida rock tank line southeastern transport compani concentr haul motor carrier liquid dri bulk commod
neutral,compani said 80 share hold compani sold meadvil hold limit hong kong list parent compani meadvil group
neutral,compani said agre eur160m unsecur credit line lender
neutral,compani said previous eb deliv custom solut lg electron make commerci avail mobil termin vendor well wireless oper
neutral,compani said oper sold newli establish compani cp gmbh present manag plastic busi coowner
positive,compani use asset strengthen balanc sheet financi posit
neutral,composit bodi coat hard coat layer produc thermal spray coat ground
neutral,connect unit 100 einvoic custom number annual transact stand nearli one million
neutral,contract includ option deliv addit 75 asc next phase project
neutral,contract worth eur 1 million
neutral,contract valu amount eur 24 million
neutral,credit cover approxim 70 ship price
neutral,custom cooper retail osuuskauppa suursavo
neutral,custom local compani etera mutual pension insur co princip tenant unit media compani alma media corp hel aln1v
neutral,custom forward site unknown log first number
neutral,deal includ rental equip relat merchandis rental contract depot two employe compani said
neutral,deal line etteplan strategi oper partner global custom provid industri technolog design servic
neutral,decis reflect underutilis line produc nonwoven use medic wipe applic well automot industri
neutral,decis made whether group agre import estonian meat meat product finland paper ad
neutral,devic also contain finnair applic compil custom feedback idea product develop
neutral,devic would launch chines market late 2006 compani said
neutral,diamet protocol develop accord standard ietf rfc 3588 ietf rfc 3539
neutral,divest activ net sale eur 1451 million 2009 oper profit eur 89 million
neutral,divest compani part tietoen busi area govern manufactur retail
neutral,dividend come top 045 eur share 043 k share alreadi paid last year account
neutral,divis also includ joint sale market control function unit
neutral,ea reng group post sale approxim 84 million kroon 2007
neutral,ebrd use fund provid 216 million loan b portion 10 million euro syndic two finnish commerci bank nordea bank finland plc pohjola bank plc
neutral,ebrd use fund provid 216 million loan b portion 10 million euro syndic two finnish commerci bank nordea bank finland plc 77 million euro pohjola bank plc 23 million euro
neutral,ebrd use fund provid 216 mln loan b portion 10 mln euro syndic two finnish commerci bank nordea bank finland plc 77 mln euro pohjola bank plc 23 mln euro
neutral,econom develop trade ministri industri energi ministri along kostroma region administr russian lumberman timber export union carri work acquir invest construct pulp paper mill neya sinc 2003
neutral,electr requir network grow new mobil gener
negative,employ contract 14 employe end march 2009 result compani previou employeremploye talk
neutral,energi sector account approxim 33 steel industri 57 transport volum
neutral,enterpris valu maritim food determin approxim eur15m
neutral,equip ixono acquir deal includ mechan engin hardwar rf antenna measur laboratori facil measur audio camera display well devic robot unit test mobil devic
neutral,equip made vaahto plant hollola finland deliveri schedul first quarter 2009
neutral,estim annual valu frame agreement eur 50mn
neutral,estim valu deal usd 92 million
neutral,eur17m contract includ design construct work
neutral,execut said countri brazil chile argentina mexico lead adopt busi ethernet servic segment brazil mexico earli adopt carrier ethernet mobil backhaul
neutral,expand compani continu call newpag
neutral,expand plant schedul oper middl octob 2009
neutral,expans final autumn 2009
neutral,expans deliv fourth quarter 2006
neutral,facil consist seven year bullet term loan 200 mln euro 2924 mln 150 mln euro 2193 mln five year revolv credit facil
neutral,facil lettabl area 19000 sq plot plant locat ratasmaki busi park purchas citi forssa
neutral,figur includ food export finland
neutral,figur includ chang fair valu properti portfolio eur 262 million
neutral,filter tip cover volum rang 011200 l includ new size 10 20 100120 200 300 1000 1200 l volum capac
neutral,final outcom right offer report around 23 octob 2009
neutral,firm build compon mobil phone commun product
neutral,goal signific expans finland northern baltic region
neutral,govern start selloff last month put 8 percent stake teliasonera auction bloc
neutral,group post net sale 353 mln euro 465 mln oper profit 760000 euro 10 mln 2005
neutral,group net sale 2007 eur683 6
neutral,group turnov 2006 eur 392 million oper profit eur 39 million
neutral,liquid handl segment offer laboratori equip accessori includ mechan electron pipett dispos tip use research institut univers hospit well pharmaceut food industri biohit brand
neutral,manufactur cpp undertaken exist export orient unit eou wartsila factori khopoli near mumbai
neutral,manufactur begin pietarsaari begin year 2009 deliveri take place octob 2009
neutral,market expect heineken sell hartwal whole part
neutral,merger two telecom oper expect result world fourth largest telecom oper
neutral,signific capit expenditur item global enterpris resourc plan erp project product develop product machin
neutral,move carri transfer hkscan productionrel properti plant equip well hold subsidiari associ compani countri hkscan finland
neutral,net sale healthcar trade busi 2009 eur 1451 million eur 1552 million oper profit eur 89 million eur 79 million
neutral,net sale power plant busi eur 7103 million 2005
neutral,new share entitl holder dividend fiscal 2006
positive,newli creat posit establish strengthen amer sport manag strateg plan execut
neutral,newspap best sale asset high qualiti journal journalist content
neutral,nonrecur cost caus talentum premedia busi area restructur amount 20 mln euro 27 mln includ compani financi result second quarter 2007
neutral,ongo project tekla structur use vashi exhibit centr develop insteel engin pvt ltdiivrcl infrastructur project ltd cidco
neutral,oper sold includ manufactur unit finland franc poland turkey well sale unit germani lithuania
neutral,option might includ partial total divest sharehold ovako
neutral,orangehandl scissor fiskar part perman design collect museum modern art new york well philadelphia museum art
neutral,order also cover design servic hardwar softwar licenc well mainten servic six year
neutral,order also includ extens mainten work shoe press deliv vaahto 2001
neutral,order consist outsourc applic manag support plan tecnotre thirdparti applic
neutral,order includ 48 ship crane deliv 12 contain feeder built wenchong shipyard china
neutral,order valu eur 69 mn consist design servic hardwar softwar licenc
neutral,order also includ highpow drive control seismic compressor
neutral,order 26 machineroomless kone monospac elev would instal 2006
neutral,oulu plant employ approxim 120 peopl
neutral,percentag share vote right calcul proport total number share regist trade regist total number vote right relat
neutral,pershar subscript price share subscrib option right eur 135
neutral,plant schedul complet late februari 2007 hand area januari two supplier nokia aspocomp group oyj perlo announc plan establish plant within nokia complex togeth invest rs 365 crore
neutral,polish busi employ 1000 peopl net sale eur 70mn 2007
neutral,portfolio compris 118000 m2 leasabl space vacanc rate roughli 5 let around 140 tenant two largest swedish govern ericsson
positive,product capac tripl without major addit invest compani said
neutral,program start summer 2007 origin estim last approxim two year
neutral,propos sharehold elect mr hannu krogeru board base long unrival experi knowledg matter relat elcoteq
neutral,remaind revenu come technolog agreement firm interdigit said
neutral,remain amount fund debt danish bank said
neutral,reorganis carri transfer hkscan corpor productionrel properti plant equip finland well hold subsidiari associ hkscan finland oy hold compani wholli own hkscan corpor
neutral,report contain categori level compani brand share well distribut share inform 2007 2008
neutral,result tax loss 250 million euro
neutral,result enabl prepar conceptu plant design capit estim
neutral,retail chain launch 2007 correspond profit sale forecast compani
neutral,russian ga giant invest anoth 46 million lita compani late 2004 own 995 percent stock capit amount 86936 million lita
neutral,second compani acquir sweden reftel maskinservic ab whose busi mainli field servic spare part manufactur 10 employe 12 mln eur sale year
neutral,segment compani oper frozen food busi seafood veget oil busi grain trade busi oper
