Type,Cleaned_content
neutral,appear statist technic surveil author custom switch servic provid mostli transfer number elisa network
neutral,expect revenu 84 billion 87 billion compar analyst estim 867 billion
positive,line plan focu select growth segment streamlin corpor structur
positive,project revenu 22 billion 23 billion slightli higher analyst estim 219 billion
positive,also strengthen ruukki offshor busi
positive,combin renew content function current system fund onlin servic well mainten
positive,jen schultebockum vodafon global director termin said compani expect sell one two million vodafon 125 225 model first year launch potenti ten million lifetim devic
positive,juha jordan chief engin glaston said one reason choos vacon global ac drive supplier servic support centr countri glaston oper
positive,kai tulonen chief technolog offic sysopen digia say mobil busi suit repres signific mileston compani offer telecommun industri
neutral,kemira suppli addit volum iron coagul compani plant helsingborg sweden
positive,last month outokumpu sold 80 percent technolog unit outokumpu technolog oyj strateg goal becom world largest stainless steel maker
positive,last week finnish metal technolog group announc plan sell 80 percent technolog unit compani strateg goal becom world largest stainless steel maker
positive,madison wi feb 6 prnewswir fiskar announc unit state patent trademark offic grant trademark registr color orang icon scissor handl
positive,manavigatorseptemb 7 2010kemira unveil indian jv ivrcl finnish chemic group kemira hel kra1v tuesday announc ink deal form joint ventur india local construct firm ivrcl infrastructur project ltd bom 530773
neutral,metso provid recoveri boiler capac 6800 tonn dri solid per day evapor plant six thermal stage capac 1600 tonn per hour
positive,metso suppli equip two process line northland resourc new kaunisvaara iron ore project sweden exploit tapuli sahavaara iron ore deposit
positive,mreal sale expect increas 4 yearonyear eur609m second quarter 2010
positive,navteq command lead instal map data system north american vehicl may leader turnbyturn navig data offer servic onstar north america said analyst phil magney telemat research group minnetonka minn
positive,nest oil board propos 100 eur dividend fullyear 2007 compar 090 eur year ago
positive,net interest incom total eur 159 mn compar eur 156 mn year earlier
neutral,net profit period 2009 euro 29 million
neutral,net profit period 2006 366 million euro
neutral,net profit period 2006 x20ac 172 million
positive,net profit 355 mln compar 298 mln
neutral,net sale expect remain level 2007
neutral,net sale sataflexo group came eur4 3 2007 group compani employ total 40 peopl
neutral,net sale 2006 total eur 302 million oper margin 16
positive,net sale 2007 expect 10 2006
neutral,net sale 2007 total eur 329 million oper margin 19
neutral,net sale 2008 expect level 2007
neutral,net sale lehdentekijat unit approxim eur 14 million 2007 70 employe
positive,nokia bought chicagobas navteq 2008 acquir map databas compet googl map well navig devic compani tomtom nv garmin ltd
neutral,nokia corp finland tuesday said receiv unifi devic manag contract finnish oper elisa oyj
neutral,nokia enough user well
neutral,eur 388 mn net interest incom
neutral,omeo wwwomeos employ 55 expect net sale 23 mln euro 298 mln fiscal 20062007 end april 30 2007
positive,oper loss eur 179mn compar loss eur 188mn second quarter 2009
neutral,oper profit quarter apriljun 2006 amount eur182 2 sale eur3 62 bn
neutral,oper profit total eur 186 mn 83 net sale
positive,oper profit eur 98 mn compar loss eur 127 mn correspond period 2009
positive,pretax loss total eur 03 mn compar loss eur 22 mn first quarter 2005
positive,pretax profit total eur 20 mn compar loss eur 1592 mn fourth quarter 2008
positive,pretax profit total eur 808 mn compar loss eur 131 mn correspond period 2009
positive,previous eb deliv custom solut lg electron make commerci avail mobil termin vendor well wireless oper
neutral,previous vaahto pulp suppli headbox rectifi roll dilut control technolog stora enso mill imatra eastern finland
positive,product expand elcoteq locat includ mexico hungari 2010
neutral,profit account period eur 03 mn
positive,rapala said estim make save 12 mln eur year centralis french oper one site
positive,reus back pet bottl also steadili increas rate use strap tape pick dip 2005 petcor said previous
neutral,russia account 9 lagarder magazin divis revenu eur 11440 mn usd 14811 mn 2009 usa 18
positive,sale expect increas end year 2006 howev
positive,satama net sale would higher year
neutral,scanfil expect net sale 2008 remain 2007 level
positive,singapor ici 1 kemira indian water infrastructur firm 2 ivrcl agre form join ventur includ new inorgan coagul manufactur facil andhra pradesh state india finnish water treatment chemic maker said tuesday
neutral,present time nokian tire contract tire product china
neutral,solvay sa engag poyri provid project manag engin procur site servic hydrogen peroxid product plant built solvaybasf joint ventur basf zandvliet site belgium
positive,southfield mich central corpor credit union distribut patronag dividend member waiv servic fee incur month juli novemb 2008 tune estim 1 million
positive,srv rais hold compani summer 2008 major
positive,systeemitiimi sale project resourc also strengthen director paul skogberg said
positive,tallink claim watertight door vana tallinn regina baltica includ electr system fulli work order
positive,talvivaara secur 10year offtak agreement 100 per cent main output nickel cobalt norilsk nickel enter longterm zinc stream agreement nyrstar nv
neutral,tekla group net sale 2005 approxim 38 million euro
positive,teliasonera secur deliveri 4g modem support 3g 2g second quarter 2010
positive,5050 joint ventur call nokia siemen network compris nokia network busi group siemen carrierrel oper creat estim synergi 15 billion euro 19 billion 2010 nokia said
positive,acquisit boomerang boat oy line done solut strategi develop busi compani acquisit
positive,action expect deliv annual cost save eur1520m
neutral,agreement cover monitor mainten server capac servic backup oneyear extens option
neutral,amend incur addit cost
positive,announc restructur significantli decreas compani indebted
positive,compani expect first order alreadi 2011
positive,compani also expect sell product russian region
neutral,compani also said board director propos profit distribut eur0 92 per share
neutral,compani close last year turnov four million euro
neutral,compani expect net sale 65 mln euro 851 mln 2006
neutral,compani expect sale revenu rmb8 0 billion 2009
positive,compani feel leas prime locat due sever produc format immedi area
neutral,compani export twenti european countri well africa
positive,compani well posit brazil uruguay
positive,compani report loss period eur 04 mn compar loss eur 19 mn correspond period 2005
neutral,compani net sale 2009 total meur 3078 oper margin 135 per cent
neutral,compani oper profit 2006 stood 396 mln euro 579 mln
neutral,compani profit total ls 134700
neutral,compani target sale ls 271 mn ls 23498 mn profit ls 300000 ls 371500 2007
positive,compani turn earn per share ep eur 003 versu loss per share eur 001
neutral,compani build altogeth 130 new substat end year
positive,diesel margin remain high
positive,divest line compani plan focu select growth segment streamlin corpor structur compani explain
positive,divest raisio margarin busi may 2009 gave compani clearer focu grainbas product
neutral,earn compar period includ capit gain eur 8mn sale omx share
neutral,finnish textil cloth compani marimekko corpor omx helsinki mmo1v report wednesday 5 novemb oper profit eur8 1 net sale eur59m period januari septemb 2008
neutral,first quarter expect line analyst forecast
positive,fourth quarter saw rapala swing back pretax profit 15 mln eur year earlier loss 12 mln back 30 pct uplift sale 448 mln eur stronger perform north america
neutral,german subsidiari produc softwar develop servic ixono telecommun busi unit client project
neutral,group consolid net sale 2008 total 34 billion euro employ approxim 13000 person
neutral,group consolid net sale 2009 total 15 billion euro employ approxim 10000 person
neutral,group revenu amount eur 80 million half account export
neutral,group revenu 2008 amount eur 94 million compani current employ approxim 730 peopl
neutral,group revenu 2009 amount eur 70 million compani current employ approxim 780 peopl
positive,group expand chain includ 45 store
neutral,insur divis turn eur120m profit
positive,iso certif demonstr move forward qualiti commit custom
positive,longterm contract global
positive,member manag team contribut adjust measur temporari salari cut 5
positive,offer repres premium 24 stock close price friday
neutral,open portal part expans strategi alma media marketplac busi unit
positive,recoveri demand start toward end 2009 continu januarymarch 2010
positive,sale healthcar trade busi support oriolakd strategi focu pharmaceut wholesal retail busi
positive,sale lead pretax capit gain eur 22 million finnish compani 2011
neutral,segment annual revenu approxim eur400m compani said
positive,soapston deposit medvezhyegorsk area expect increas tulikivi current reserv consider
neutral,solvenc capit ratio compani 27 time solvenc limit
positive,said contract estim contribut eur150m net sale 2010
positive,measur expect produc annual cost save eur 15 million start 2007
positive,bring cost save eur 3mn year
positive,acquisit solteq expand solut offer microsoft dynam busi softwar product
neutral,agreement japrotek deliv nine storag tank volum rang 1000 cu 3000 cu includ agit
positive,agreement tietoen provid blyk extend applic busi process manag servic infrastructur
neutral,agreement ponss provid forest machin mainten servic stora enso russian wood procur oper
positive,contract cramo sverig subcontractor brinkab ab provid scaffold instal lkab new pellet plant kiruna northern sweden
neutral,term agreement lextel group commit open order eur3 75 benefon mobil unit cobrand capitel china market
neutral,vacon offic support custom brazil south america
positive,capit experi number similar bridg project nordic countri
positive,via move compani aim annual save eur3m main part expect realiz year
neutral,second phase new innova build tecnopoli presenc jyvaskyla increas total approxim 62000 floor squar meter
positive,acquisit panostaja oyj expand busi area specialis digit print
neutral,moodi said gave p a1 longterm senior unsecur p p1 shortterm debt rate finnish lender aktia bank eur1bn usd1 4 bn euro mediumterm note emtn program 25 march 2011
positive,brazilian nonprofit interbank camara interbancaria de pagamento cip acquir solut us busi integr solut provid sterl commerc latter compani said statement
positive,leipurin grow rapidli internation group
positive,ntc geograph presenc complement ramir exist network bring us closer custom east bohemia region czechrepubl
positive,sever growth initi chosen geograph area alreadi ongo continu note lindex open first store czech republ autumn brno
positive,analyz kaupth bank sweden found busi fit well alandsbanken said alandsbanken chief execut peter wiklof statement
positive,2010 16 juli 2010 finnish steel maker rautaruukki oyj hel rtrk ruukki said today turn net profit eur20m second quarter 2010 net loss eur94m correspond period last year
positive,28 octob 2010 finnish wood product technolog supplier raut oyj hel rutav said today swung net profit eur3m first nine month 2010 versu net loss eur5 2 period year earlier
positive,3 februari 2011 finnish broadband data commun system provid telest oyj hel tlt1v said yesterday net profit rocket eur4 8 2010 eur416 000 2009 lift dividend propos
positive,4 februari 2011 finnish broadband data commun system provid telest oyj hel tlt1v said wednesday net profit rocket eur4 8 2010 eur416 000 2009 lift dividend propos
positive,agreement shb 30 decemb 2009 finnish financi servic group aktia hel aktav conclud market make agreement svenska handelsbanken sto shb shb two parti said today
positive,austin texa sept 6 texa depart transport award contract telest video compress distribut equip
positive,cargotec corpor press releas august 26 2008 10 finnish time cargotec macgregor busi area provid marin cargo handl offshor load handl solut receiv signific offshor crane retrofit order
positive,ceo compani tarmo noop said growth sale premium beer biggest
positive,ebit total eur 144 mn compar loss eur 03 mn correspond period 2009
positive,finnish broadband data commun system provid telest oyj hel tlt1v said yesterday return net profit eur 27 million usd 38 first nine month 2010 versu net loss eur 579000 period 2009
neutral,finnish construct compani lemminkainen oyj hel lem1 said yesterday would build plastic film extrus plant packag materi supplier ab rani plast oy lemminkainen kaluga industri park russia
positive,finnish consum packag manufactur huhtamaki oyj said swung net profit 841 mln euro 1056 mln first nine month 2006 net loss 26 mln euro 33 mln period 2005
positive,finnish dental care group oral hammaslaakarit oyj post total net profit 849000 euro 11 mln first nine month 2006 versu net loss 331000 euro 421000 period 2005
positive,finnish consult satama interact oyj post net profit 14 mln euro 20 mln first nine month 2007 compar net loss 462000 euro 664000 period 2006
positive,finnish pulp paper machineri maker vaahto group oyj swung 11 mln euro 14 mln net profit fiscal 200506 end august 31 2006 249000 euro 319000 net loss fiscal 200405
positive,finnish silicon wafer manufactur okmet oyj said swung net profit 49 mln euro 63 mln first nine month 2006 net loss 18 mln euro 23 mln year earlier
neutral,glaston also effici measur unit
positive,growth strongest fsecur oper isp mobil oper cabl oper busi
positive,second quarter 2010 compani net profit eur1 7 compar net loss eur1 3 apriljun 2009
positive,therefor seem finnish ship compani vike line get subsidi need order new lngfuell vessel
positive,jarmo honkamaa head oil refin busi nest oil say situat look promis viewpoint
positive,adp new feb 25 2009 finnish print circuit board pcb maker aspocomp group oyj hel acg1v said today swung net profit eur 300000 usd 385000 2008 versu net loss eur 653 million
positive,adp new nov 6 2008 finnish retail softwar develop aldata solut oyj omx ald1v said today swung net profit eur 21 million usd 27 first nine month 2008 versu net loss eu
positive,mformat nokia note establish interoper agreement cover commerci proven standardsbas manag mobil devic well mobil devic secur mobil applic manag
positive,mn pretax profit eur 464 mn eur 358 mn third quarter 2006
positive,net sale howev increas 2005
neutral,nokia deliv wcdma 3ghspa radio network includ modular high capac nokia flexi wcdma base station indosat
positive,oper profit total eur 177 mn compar eur 176 mn correspond period 2007
positive,order intak hand expect stronger 2007
positive,outokumpu finland stainless steel manufactur plan enter suppli agreement indian railway
positive,profit tax eur 01 mn compar eur 04 mn previou year
positive,profit period eur 156 mn compar eur 141 mn 2007
positive,quarterli dilut ep continu oper came 021 eur compar last year 012 eur
positive,rapala estim net sale 2008 increas 80 pct 12 pct assum 2007 exchang rate
positive,raut post net profit 18 mln euro 26 mln third quarter 2007 compar net loss 299000 euro 430000 correspond period 2006
positive,return equiti stood 183 compar 154 third quarter 2005
positive,russian export duti activ harvest finland sale russia increas also
positive,tectia corpor hel tec1v provid realtim secur solut today announc appoint lan2lan provid servic uk distribut data secur manag file transfer softwar
positive,bristol port compani seal one million pound contract cooper specialis handl suppli four 45tonn customis reach stacker konecran
positive,compani expect net sale significantli increas 2009
positive,compani net profit amount ee 555 mn 36 2004
positive,compani said suppli wcdma 3ghspa radio network includ modular high capac nokia flexi wcdma base station east java bali sumatra batam
neutral,contract trade alltim high 50200 ton april 24
positive,ebitda eur116m compar eur115m correspond ebitda margin 33
positive,fair valu invest properti total eur 22999 mn compar eur 22295 mn correspond period 2009
positive,fund fair valu increas correspondingli
neutral,impact acquisit telest net sale 2010 estim approxim eur 2 million
neutral,impact tietoen net sale 2008 purchas expect 11 mln euro 159 mln
positive,optim steel compon heat process reduc energi consumpt
positive,proport estonian lithuanian passeng tallinnhelsinki rout also grew juli
neutral,save full impact begin 2007
positive,assign strengthen poyri posit intern provid engin project servic chemic process industri
positive,new partnership agreement repres signific mileston parti
positive,tiimari latvian repres ineta zaharova said compani earn lvl 122000 2005 profit 20 time 2004
neutral,togeth yahoo nokia said continu deliv internet experi address core need consum develop oper advertis
positive,via agreement ramir expand rang equip servic deliv destia ramir finland manag director kari aulasmaa said
positive,via takeov panostaja expand busi area specialis digit print sinc previous consist subsidiari kopijyva oy sokonet oy
neutral,ing larsen cfo 29045 share repres 050 share capit
neutral,forecast 2012 33
neutral,share capit alma media corpor busi id 19447574i eur 4503151380 divid 75052523 share
neutral,compani list nordic exchang helsinki
neutral,incap contract manufactur carri manufactur agreement factori tumkur near bangalor
neutral,oper nokia support nokia netact network servic manag system
neutral,28 januari 2011 finnish technolog center oper technopoli oyj hel tps1vsaid today invest eur22 5 construct second phase offic facil tamper
neutral,comptel corpor publish financi statement 2008 12 februari 2009
neutral,finnish lt recoil compani specialis use oil regener build facil hamina finland 2008
neutral,shop locat capit region paijatham region
neutral,carrier said area travel agenc sell outlet sister chain suomen matkatoimisto smtand use remain bricksandmortar presenc primarili target busi custom go forward
neutral,annual net sale unit eur 5 million current employ 55 peopl
neutral,follow workday custom check home comput purchas divid differ ingredi group much energi variou product contain nutrit content purchas
neutral,name compani hold acquir citycon oyj 2
neutral,baswar headquart espoo finland
neutral,store locat poznan shop center name pestka compani ad
neutral,seat would go edgar edmond american experi cloth retail industri christian fischer austrian experi winter sport good busi
neutral,accord act univers acquir privat fund
neutral,follow strategi tikkurila establish fullyown sale compani tikkurila almati kazakhstan market decor paint finnish tikkurila brand russian tek brand
negative,asian traffic declin 34 per cent
neutral,ahlstrom 5700 employe serv custom via sale offic product facil 20 countri six contin
neutral,raut headquart nastola finland technolog compani serv wood product industri worldwid
positive,consum product manufactur fiskar corp open distribut warehous center southaven creat 100 job
neutral,accord latest inform benefon launch twig devic 20 septemb 2006
neutral,atria also buy share kauhajoen teurastamokiinteistot oy kauhajoki slaughterhous propertyfrom itikka cooper
neutral,joint ventur invest eur 500000 product technolog straight away
neutral,report capman plc ceo heikki westerlund
neutral,price specifi complet date
neutral,total 78 million invest project
neutral,finnish consult satama interact oyj said novemb 13 2006 jarmo lonnfor took posit ceo
neutral,h1 08 h1 07 q2 08 q2 07 mln euro unless otherwis state net sale 386 3286 201 1607 oper profit 463 358 232 95 pretax profit 336 269 187 51 net profit 251 254 14 40 ep euro 220 236 124 038 10 euro 160 wwwcomponentacom
neutral,nordea definit big sampo acquir said analyst sampo would appear agenda nordea ahead privatis
neutral,fix mobil converg solut repres key valu proposit today commun market
neutral,room modifi share compon alreadi indic
neutral,could
positive,lowest bidder final approv await
neutral,1 pm central offic nordea bank 19 3ya ulitsa yamskogo polya build 1 telephon 495 7773477 ext 3932 3931 03022011 unimilk egm 0304 022011 xvi intern businesssummit food busi russia 2011 take place
neutral,128538 share still subscrib seri e share option max
neutral,15 novemb 2010 finnish energi compani fortum oyj hel fum1v said today partner start negoti establish new oper model energi suppli turku region western finland
neutral,561470 new share 2003 option right plan packag compani huhtamaki oyj report monday total 561470 new share compani issu base share subscript 2003 option right plan
neutral,meet media analyst held day 1030 stonesoft headquart helsinki italahdenkatu 22 interim report present stonesoft ceo ilkka hiidenheimo
neutral,meet glisten sharehold vote bid held 12 march
neutral,replay avail 27 octob 2006 follow number us caller 1 6178016888 nonu caller 44 20 7365 8427 access code 2659 5401
neutral,spokesman said food store center subject council local support could compris supermarket smaller store nich outlet firm follow consult council local commun regard appropri use occupi
neutral,total 185 wonderwar certifi si avail integr support wonderwar product intouch hmi softwar industrialsql server historian wonderwar inform server dt analyst softwar qi analyst spc softwar
neutral,le coq market share 413 percent rival beverag group saku 321 percent
neutral,36 came aspo chemic 39 aspo ship 25 aspo system
neutral,72 evraz group share own lanebrook whose beneficiari one hand millhous hold compani asset billionair roman abramovich busi partner 50 evraz execut alexand abramov alexand frolov 50
neutral,absolut bank explor possibl borrow
neutral,aker yard finland begin use chines subcontractor finnish shipyard
positive,finnish food industri compani hk ruokatalo atria form joint ventur compani call lnsikalkkuna produc turkey meat
neutral,finnish food industri compani lnnen tehtaat plan chang fish product busi
negative,finnish plumb heat system supplier uponor temporarili lay whole workforc finland two week midjuli 2009
neutral,finnish properti invest compani citycon plan issu direct subordin convert bond institut investor
neutral,finland hamina cargo termin finnish nurminen logist purchas warehous ground leas right port hamina
negative,finland metal sector compani componenta lay temporarili staff pori mill christma 2008 till 6 januari 2009
neutral,member hk ruokatalo group finland scan launch joint ventur slaughterhous team ugglarp sk_ne southern sweden
neutral,largest construct compani finland yit corpor acquir 70 share slovak construct compani rede bratislava
negative,accord aktia asset manag finnish analyst forecast 2009 still high
neutral,accord busi media report usmanov plan transfer megafon stake statecontrol svyazinvest exchang stake merg rostelecom
neutral,accord ceo hannu syrjnen new common name visual ident requir group grown internationalis
neutral,accord gallup food farm fact beef consumpt total 99mn kilo finland 2007
neutral,accord construct work start spring 2007 facil commiss spring 2008
neutral,accord soosalu particular attent paid resid privaci secur design aleksandri street build
neutral,accord statist finnish maritim administr ship increas much januaryaugust 2009 howev
neutral,accord compani decis issu made summer 2010 earliest summer 2011 latest
neutral,accord compani layoff temporari
neutral,accord finnishrussian chamber commerc major construct compani finland oper russia
neutral,accord notif hold ameripric inc group compani total 808973 share repres 3582 tekla share vote right
neutral,accord report elisa dna joint market share finland telecom market 59
neutral,two compani sat sew present deal
neutral,sale savcor group ltd compris savcor art corpor function invest cencorp corpor
neutral,ahlstrom 5800 employe serv custom via sale offic product facil 20 countri six contin
neutral,ahlstrom share quot nasdaq omx helsinki
neutral,ahlstrom share quot nasdaq omx helsinki
neutral,airbu attempt evacu 873 peopl within 90 second
neutral,alexandria va june 7 michael g william newburi park calif develop network devic
neutral,right reserv
neutral,yit capit market day materi avail compani internet site wwwyitgroupcominvestor 1030 septemb 26
neutral,alma media hold 70 compani remain share own compani key employe
neutral,almost entir offic build occupi metso
neutral,also westpac issu benchmark 18 month frn deal euro
neutral,also develop onlin busi continu
neutral,altimo previous agre similar deal telenor merg stake vimpelcom kyivstargsm
neutral,part agreement 10 employe john deer forestri document function transfer dokumentori oy
neutral,result total 82 employe would given notic
neutral,result transact sanoma budapest acquir stake onlin store egeszsegbolt
neutral,altern share exchang panostaja offer full cash consider valu 127 euro 17 per share
negative,part reorganis measur take place spring 2006 tamglass finton start personnel negoti affect entir staff 33
neutral,report june 26 circuit continu altern report track vacant occupi almost constantli june 17 part track signal devic replac time crash accord metro sourc
neutral,1058 outokumpu declin 274 pct 2487 eur omx helsinki 25 055 pct higher 282514 omx helsinki ad 064 pct 938689
neutral,900 eet alma media annual report 2009 schedul publish calendar week 9
neutral,endaugust sampo nordea biggest sharehold 206 stake follow state 199
neutral,first solteq servic compani oper st petersburg area includ mainten materi manag system data collect solut
neutral,autotank group part aspo system divis
neutral,baswar einvoic oy merg parent compani present fiscal period
neutral,applic consid hack applic classifi fsecur riskwar
