Type,Cleaned_content
neutral,invest span across variou product invest type includ retail hospit offic residenti interest realest portfolio nonperform loan corpor restructur
neutral,also recov valuabl raw materi kemira water chemic product
neutral,necessari strengthen compani oper howev
neutral,use proce transact achiev target
positive,kai tulonen chief technolog offic sysopen digia say use corpor phonebook insid sysopen digia extens sinc last fall satisfi result
positive,last year lemminkainen complet kouvola ksupermarket contract
neutral,le lay succe walter gnter base finland
neutral,lemminkainen infra oy subsidiari lemminkainen sverig ab perform construct work expect start earli 2011 complet summer 2013
neutral,lo angelesbas pacif offic properti trust acquir own oper offic properti western us focus initi market honolulu san diego lo angel phoenix
neutral,master mayawa jointli develop nokia siemen network ufa fremantlemedia activ advertis maxi end may 2007
neutral,medic devic russia brandnew market analysi give clear overview actual situat futur outlook medic devic market russia
positive,metric qpr scorecard support date text milestonebas valu improv support manag project around perform processrel content
neutral,mformat provid enhanc manag applic enabl configur control throughout lifecycl
neutral,mr jorma valkama manag director suomen paikallissanomat oy state rannikkoseutu complement outstand way current product rang compani
neutral,mr mikko saavalainen head comptel global sale conclud gibtelecom provid perfect illustr varieti busi technic regulatori challeng oper face oss today
neutral,nest oil said result biomass 3 liquid demonstr plant commiss june 2009 promis decis commerci plant taken
neutral,nokia continu invest futur develop qt digia respons commerci licens servic busi
neutral,nonwoven specialti paper made ahlstrom use larg varieti everyday product eg filter wipe floor label tape
neutral,nokia announc launch bicycl charger kit compat nokia phone 2 mm charg interfac
neutral,basi competit bid ooo kitai stroi russian subsidiari china state construct engin corpor construct compani own china state select main constructor
neutral,time nokia india largest mnc sought topic could spark million approach creativ emerg market
positive,carrier handset maker spin posit event rais interest higherend phone pricier data plan
neutral,potenti client includ public administr organ invest util network servic
neutral,solut fulli arab messag want becom partner choic busi neareast region
positive,pearl plaza llc joint ventur srv shanghai industri invest hold co ltd conclud invest decis construct first phase shop center saint petersburg russia
neutral,poyri plc addit inform martin kuzaj presid industri busi group finland tel 358 10 33 21179 sanna paivaniemi director investor relat poyri plc finland tel 358 10 33 23002 poyri global consult engin compani dedic balanc sustain
neutral,profession consum applic includ person navig person safeti field workflow manag asset track
neutral,satama trainer hous remain name independ brand busi area
neutral,talvik say reloc applic program server continu hp server approv hp suppli tailormad solut elisa
positive,technopoli st petersburg govern sign cooper memorandum octob 2005 set technopark neudorf product zone villag strelni st petersburg suburb
neutral,tekla structur 16 team compat window 7 oper system
positive,tekla structur bim build inform model softwar develop accord longterm plan improv user experi process function
positive,teliasonera lead telecommun compani nordic baltic region
neutral,mention sharehold suggest monthli salari eur 1400 would paid board member outsid compani
neutral,address locat provid local control prefer wireless transmiss use address locat access applianc control modul
neutral,aim bridg solut chosen minim construct time ensur traffic beneath bridg saimaa canal continu undisturb
neutral,bank also examin benefit transfer swedish busi oper branch offic oper would govern finland law
neutral,compani admit 36 month rel short time oper russia
neutral,compani wide select metal product servic
neutral,compani charg natur ga storag activ franc great britain germani
neutral,cooper airbalt expect lead transfer finncomm ownership airbalt time
neutral,court decis also promot genuin competit servic
neutral,daili graphic newspap octob report initi embark upon fidel bank partner ghana post offic across countri offer financi servic unbank underbank countri
neutral,devic also use theft protect posit vehicl boat asset
neutral,donat grant aalto univers univers helsinki tamper turku eastern finland jyvskyl oulu vaasa polytechn announc later
neutral,estonian beverag maker le coq today brought market new premium class beer le coq special invest 6 million kroon eur 383000 develop plan sell three million liter beer next year
neutral,first phase complet end 2012
neutral,guidanc set 90 basi point midswap report said
neutral,invent carri intern patent public
neutral,inventor byland johan ponten fredrik lundberg jorgen
neutral,inventor mukkavilli krishna kiran sabharw ashutosh aazhang behnaam
neutral,inventor ridg justin bao yiliang karczewicz marta
neutral,issuer sole respons content announc
neutral,issuer sole respons content announc
neutral,market make accord agreement begin septemb 24 2009
neutral,offer price 35 million includ cash 10 million net debt assumpt face 20 million worth cencorp share issu savcor
neutral,ore bodi suffici support anticip product least 46 year
neutral,origin patent file finland applic
neutral,reloc ragot alreadi start complet next week waterqueen tortu move plan mid2008 vmc europ third quarter 2008
positive,report provid comprehens insight compani includ busi structur oper execut biographi key competitor
neutral,reward paid basi earn period 2011 correspond valu maximum total 364000 componenta corpor share includ also proport paid cash
neutral,right margin view separ detail everi custom
neutral,servic also enabl user watch email html format en enhanc 23 addit languag choos
positive,servic also give supplier opportun keyin invoic receiv order electron send order confirm upload creat electron catalogu
neutral,swedish subsidiari hold 10 net smelter return nsr royalti two advanc copper project northern sweden viscaria adak project develop avalon miner ltd asx avi
neutral,total invest vantaa plant extens amount around 10 million euro okmet share invest worth around 27 million
neutral,valu deal exce eur500 000 compani said
neutral,implement upgrad exist system enabl voicemail video mail hous platform
positive,second success effort financi investor year
neutral,travel expens would reimburs accord travel polici compani
neutral,welcom
neutral,well servic import futur
neutral,need readi window open rosberg said
neutral,tikkurila inspir color life
positive,lietuvo respubliko sveikato apsaugo ministerija award contract uab affecto lietuva financi system softwar packag
neutral,cf2 pti ltd becam substanti holder renison consolid mine nl januari 25 150 million share 79 pc
neutral,raffl equiti ltd becam substanti holder archer explor ltd januari 12 117 million share 182 pc
positive,nordea move new headquart signifi begin new era
neutral,respect decis discuss close said kai telann alma media ceo
neutral,director sharehold alik ask practic allow continu
neutral,everi partner allow buy quantiti electr correspond share consortium product cost letter intent said
positive,happi outcom sneed said hear
positive,instal automat varnish line import part compani strategi region central eastern europ said jozef misurec director ruukki slovakia
positive,allow young child move forward life
positive,decis resolv meego stronger continu
neutral,issu identifi stonesoft affect rang content inspect technolog
neutral,want credit card info person detail
neutral,hope clarifi polici finnish busi gray area motlanth said
neutral,relev author approv make mandatori bid requir finnish secur market act
positive,1 novemb 2010 finnish textil cloth compani marimekko oyj hel mmo1v announc friday open first concept store seoul cooper japanes sector player look inc tyo 8029
neutral,broad rang connect option includ 3g hspa wifi give consum high speed access internet
positive,new product line complet contract product hormon treatment
neutral,quick onestopshop understand compani
neutral,dopplr dopplr servic smart travel
positive,elcoteq elcoteq se lead electron manufactur servic em compani commun technolog field
positive,nokia nokia pioneer mobil telecommun world lead maker mobil devic
neutral,stonesoft corpor stonesoft corpor omx sft1v innov provid integr network secur solut secur inform flow distribut organ
neutral,accord sweden minist local govern financi market mat odel decis sell state share telecom group teliasonera carri cooper state finland
neutral,finnish beverag compani olvi introduc new long drink olvi kultalonkero golden long drink market finland spring 2009
positive,finnish geosentr develop provid solut product technolog locat base servic preliminari agre eur 6mn shortterm fund lead investor
positive,finnish raisio diagnost launch new dnabas quick test ensur safeti food
neutral,finnish rautaruukki sell precis tube automot compon process unit carl froh germani german arqu industri
negative,finnish suominen corpor make wet wipe nonwoven flexibl packag start employeremploye negoti tamper plant finland lay 25 employe
neutral,swedish wallenberg famili control investor bought larg stake c share swedish retail bank seb
negative,accord arokarhu purchas scan cash regist comput disappear total sum key press
neutral,accord barclay fsecur softwar protect user hacker virus spywar digit attack
neutral,accord capman plc corpor govern major committe member shall independ compani
neutral,accord finnair technic servic measur due employ situat
neutral,accord honka japan manag director marko saarelainen honkarakenn export 200 readi made log hous japan year
neutral,accord preliminari data slovakia statist offic good worth e36 4 million import finland januari octob 2010 make 01 percent slovakia total import
neutral,accord seikku retail sector finland control 34 larg actor food manufactur still rel small
negative,accord compani staff laid temporarili necessari
neutral,accord tyrvinen estim japan essenti locat term finnair asian strategi
neutral,accord vauramo plant lift equip suitabl asian chines truck
neutral,sign total amount aspo revolv credit facil agreement eur 50 million replac formerli valid agreement eur 80 million
neutral,ahlstrom corpor stock exchang releas 13022008 ahlstrom global leader high perform fiberbas materi today announc complet acquisit friend group inc consist west carrollton parchment compani west carrollton convert compani
neutral,aho proud compani new product lordicola
neutral,aldata share space optim vision apollo user group 2009 categori manag associ confer compani unveil new solut combin busi intellig space plan data confer
neutral,alexandria va aug 27 timo vataja tamper finland virv inget oulu finland develop comput program product activ right use
neutral,also sevenyear histor analysi provid market
neutral,also sixyear histor analysi provid market
neutral,also sixyear histor analysi provid market
neutral,also technopoli plan build 100 million euro technolog park special econom zone neudorf st petersburg st petersburg govern said februari
neutral,also chile import market area forest machin compani
neutral,also tradit grapevin carri lot weight
positive,altia oper profit jump eur 47 million eur 66 million
positive,altimo teliasonera said yesterday usmanov would welcom join new compani
neutral,amanda said alreadi made usd5 0 invest commit russia partner ii fund juli 2005
neutral,invent releas patent offic said chamber pressur
neutral,audio webcast avail live archiv cerner web site wwwcernercom
neutral,anttila onlin depart store netanttila establish posit bestknown visit shop onlin store finland
neutral,apart nordea also ergo compet posit among top three pension fund provid estonia
neutral,result merger largest profession electron telecommun technolog contract manufactur center finland form sievi
negative,result negoti employ 130 blue whitecollar employe oulu plant would termin
neutral,august 2008 glaston north asian sale servic region upgrad new market area north asia
neutral,world leader develop uv technolog municip wastewat drink water industri water treatment system trojan technolog logic partner provid wrtsil uv technolog ballast water treatment
neutral,aspo strong compani brand esl ship leipurin telko kaukomarkkinat aim market leader sector
neutral,stage maximum 60000 tulikivi seri share acquir repres 016 per cent compani share outstand
positive,atria group lead scandinavian meat product group
positive,atria launch campaign septemb promot campomo brand moscow market said
neutral,baswar order match automat match purchas invoic approv purchas order
positive,bg ad bulgaria lead internet compani
neutral,capac facil made finland vaahto group 86000 ton light coat paper
neutral,capman asset manag eur 3bn worth asset manag nordic region
neutral,capman four invest area capman buyout capman technolog capman life scienc capman real estat dedic team
neutral,castecka said town hall would hold talk investor interest zone
neutral,central europ import market area honka
neutral,cent recogn potenti partnership supplier
positive,certain sharehold irrevoc agre vote favor bond issu
neutral,chang announc today effect close trade friday june 19 2009
neutral,chief financi offic jim heindlmey said beyond oblivion advanc talk four major record compani servic
neutral,ch expo freight major finnish fair exhibit cultur logist compani provid logist servic variou event land air sea
neutral,competit author approv deal final
neutral,complet name sharehold otto henrik bernhard nyberg inform pleas contact maijaliisa friman ceo tel 358 9 7597 0711
neutral,complet transact subject final agreement due dilig process
neutral,construct expect complet summer 2011
neutral,consum increasingli interest heir phone
neutral,crucial decis use etsi european telecommun standard institut back dvbh add grow list oper equip manufactur opt standard see global 20 januari 2006 compet technolog vie mobil tv
neutral,current 100 global fortun 500 compani use ssh secur solut
positive,demand seem hit bottom sign improv seen
neutral,dnb nord norway like nordic buyer citadel nordea would good strateg fit accord document publish pietiek
neutral,donat univers annual gener meet author board director donat max
neutral,dopplr member share person busi travel plan privat network highlight interest place stay eat explor citi around world
neutral,dragonfli love anoth video shot start finish use nokia n8
neutral,past 10 year factori produc mani nokia popular model includ nokia 2760 nokia 6300 well nokia latest music devic nokia 5800 express music
neutral,eb hold exclus right market new entiti product
neutral,elcoteq electron manufactur servic em busi segment serv custom global engin manufactur fulfil servic
neutral,elisa corpor headquart helsinki finnish telecomm compani offer privat corpor custom comprehens rang telecomm servic
positive,employe also better prepar answer call sinc alreadi detail inform caller answer phone
neutral,entir paper mill may set especi new eu member state
neutral,eqt complet exit salcomp finnish compani make mobil phone charger sell remain stake swedish invest group nordstjernan euro 35 million 47 million
neutral,even tulikivi emiss well strictest state standard includ washington colorado
neutral,fcc chairman kevin martin said fair play requir extend deregulatori rule digit subscrib line telecom provid use broadband network
neutral,financialwir tm cooper investrend broadcast syndic also provid complet daili confer call webcast schedul servic sharehold investor via firstalert tm network oefirstalert tm daili
positive,finnish autom solut develop cencorp corpor omx helsinki cnc1v said friday 27 june complet employe negoti regard reorganis oper
neutral,finnish consum prefer buy cheapest beer brand
positive,finnish engin technolog compani metso oyj said may 27 2008 complet acquisit paper machineri technolog japanes engin compani mitsubishi heavi industri mhi undisclos sum
neutral,finnish hold compani panostaja oyj said june 12 2007 sign letter intent acquir local lahden lampokasitt oy heatmast oy activ heat treatment metal total 31 mln euro 41 mln
neutral,finnish paint coat compani tikkurila oyj hel tik1v announc today launch tikkurila prohous method protect wooden surfac via treatment ultra pro waterborn product
neutral,follow registr number issu outstand share baswar 12890829
neutral,fortum previous bought stateheld stake tgk10 rao ue reform
neutral,found 1649 fiskar 360 year product qualiti excel finland oldest compani
positive,furthermor fulli electr driven crane environment friendli
neutral,genvec biopharmaceut compani develop novel therapeut drug vaccin
neutral,geosentr flagship product gypsii platform use pioneer geoloc softwar technolog connect peopl peopl peopl place new excit social commun locationspecif servic
neutral,glaston wellknown brand bavelloni preprocess machin tool tamglass uniglass safeti glass machin albat wirsam softwar solut
neutral,glaston wellknown brand bavelloni preprocess machin tool tamglass uniglass safeti glass machin albat wirsam softwar solut
neutral,goodwil intang asset account 20 mln euro 26 mln purchas price 20 pct payabl aspo share
positive,grapevin citi offici septemb approv 35 million tax rebat grant expans
neutral,gunneflo respons oriolakd pharmaceut trade busi sweden
neutral,harju elekt found 1968 lead produc electr equip materi baltic state
neutral,harold w young independ broker work close sever retail includ ahold usa market basket cv bj wholesal club hannaford cumberland farm
positive,also mention improv servic follow recent expans finnlin servic bilbao via antwerp helsinki hull via helsinki st petersburg
neutral,helsinki afx outokumpu said agre sell hitura nickel mine finland canadian group belveder resourc ltd 10 mln eur worth belveder share
neutral,hkscan headquart turku finland lead northern european food group 10000 employe nine countri
neutral,hkscan one lead food compani northern europ homemarket finland sweden baltic countri poland
neutral,honkarakenn mainli export larg luxuri log hous russia use onefamili hous holiday home 70 sale go moscow region 20 st petersburg region remaind locat
neutral,howev shortterm rental becom popular
neutral,huhtamaki oyj stock exchang releas 16122008 0930 huhtamaki oyj resolv clarifi group structur separ foodservic consum good busi product unit hameenlinna finland transfer busi wholli own subsidiari
positive,iggesund bruk sweden one advanc fulli integr pulp paperboard mill world
neutral,addit yit reserv epi russia right expand logist center 100000 m2
neutral,addit present held presid ceo kai telann cfo tuoma itkonen particip opportun discuss member compani manag
neutral,finland 71 paper paperboard reclaim
neutral,finland export industri form larg clientel packag industri
neutral,provid manag servic nokia take respons build oper transfer well optimis indosat 3g network
neutral,switzerland telest establish supplier product long time primari custom includ cabl fibertothehom ftth oper
neutral,end sanoma new want secur foundat save
positive,homewar area fiskar provid lead brand product home kitchen interior design
neutral,survey goodyear third valu tyre brand follow continent bridgeston
neutral,today busi preempt consum want said moham zainalabedin gener manag zain bahrain
neutral,ingen establish medic devic manufactur emerg new medic product line respiratori market worth estim 4 billion us 8 billion global
neutral,insur polici simpl
neutral,sever innov small molecul biolog drug candid differ stage clinic develop
neutral,sold one half busi oper enter helsinki stock exchang via back door innov buyout arrang kasola
neutral,member oneworld allianc includ american airlin british airway
positive,solid credit compar dz bank rabobank
neutral,expect complet end 2007
neutral,plan set class busi center two top storey complex
neutral,posit compani recruit harri koponen ceo accord affarsvarlden
neutral,first oil compani join rspo commit fulli sustain sourc feedstock product nexbtl biodiesel said
neutral,provid heat form hot water sawmil need
neutral,168 asset manag expert manag asset worth eur 35 billion
neutral,wellknown brand includ fit equip maker precor us base ball sport equip maker wilson
neutral,janno reiljan member eesti energia supervisori board said owner narva power grid inform eesti energia wish sell
positive,jawad william score 23 point impress debut jerusalem jason rich ad 18 yuval naimi chip 16 point hapoel visit yellowandblu next week
neutral,jon risfelt 49 year old hold master scienc chemic engin swedish royal institut technolog
neutral,juha haapakoski continu editorinchief budget respons also new publish
neutral,jun 14 2009 aol weblog deliv newstex look like e71 upstag nokia nyse nok premier businessclass smartphon someon espoo hit corpor youtub account promo video e72
neutral,jun 25 2008 boy geniu report deliv newstex nokia nyse nok n78 huh
neutral,kone headquart espoo finland one world lead elev escal compani
neutral,last juli group said intend reloc warehous offic space loudeac saint marcel morvillar east franc alreadi oper hook manufactur distribut unit
neutral,lember said matter topic also estonia bill draft social affair ministri would scrap oldag pension favor condit
neutral,lind act respons toward sharehold busi partner employe societi environ everi one busi area region locat across globe
neutral,lkab headquart lulea sweden hightech mine compani produc upgrad iron ore product steel industri
neutral,llc voic data manag solut provid wireless compani oper worldwid transfer us deploy oper finnish mobil giant includ civil work site acquisit servic
neutral,look vintag fabric cushion cover 70 coffe pot ceram serv dish cocktail glass stainless steel parti dish
positive,ih move enhanc growth
neutral,lsc 30 employe move ixono exist statu benefit
neutral,meego learn use fisher said put import thing top
neutral,merg two free sheet clarifi market situat
neutral,metso global supplier sustain technolog servic mine construct power gener autom recycl pulp paper industri
positive,200 volunt fiskar garden tool compani home depot nyse hd citi baltimor neighborhood work right creat garden sanctuari singl day
neutral,name applic jot autom oynam inventor mammila tuomo piirainen mika kellokoski mikaappl 2424kolnp2008 adat file applic 16062008public date 30012009
positive,nasdaqlist yahoo inc introduc new servic enabl malaysian take favorit internet content servic mobil phone
neutral,nation sponsor big read includ nation endow art cooper institut museum librari servic art midwest
neutral,neomarkka play lead role group aim restart product specialti cellulos fiber valkeakoski
neutral,nest oil corpor refin oper asset summari report summari nest oil corpor refin oper asset summari report essenti sourc compani data inform
neutral,nest oil extend yesterday gain put 049 pct 2272 eur util fortum shed 114 pct 2076 eur
positive,nordea bank sto nda sampo bank help finnish real estat invest compani sponda hel sda1v place eur100m usd125 4 domest bond compani said friday
neutral,cours direct access nokia ovi store lot fun download favorit media
neutral,share 14747084 held compani number outstand share vote right attach share amount thu 161256847
neutral,oka specialis new construct renov work residenti nonresidenti build well premis industri logist use
neutral,okmet board director also decid new share ownership program direct compani top manag
neutral,okmet silicon wafer part process chain produc end product improv human interact qualiti life
positive,oleari materi handl servic locat perth lead compani western australia suppli instal provid servic tail lift
positive,one attract factor tablet media compani provid new way make money
positive,one uponor promis futur product hydron cool system
neutral,oriolakd headquart espoo finland lead distributor pharmaceut healthcar product 1300 employe nordic baltic countri
neutral,sharehold entitl becam effect today
neutral,cannedpreserv food finland report offer comprehens guid size shape market nation level
neutral,solut industryindepend support multilingu currenc need modular applic compani size ceo ilkka sihvo said
positive,strong compani brand esl ship leipurin telko kaukomarkkinat aim market leader sector
neutral,outotec headquart espoo finland lead provid process solut technolog servic mine metallurg industri
positive,overal 50 percent respond confid secur bank onlin
neutral,panostaja headquart tamper finland invest compani focus small mediums finnish compani oper tradit industri
neutral,perform base valu sustain
neutral,pertti ervi independ compani major sharehold
neutral,pleas inform ir johanna koskinen particip later 20 april 10 telephon confer financi analyst investor conduct english begin 300 pm finnish time eet
neutral,poyri energi gmbh austria lead engin consult compani energi infrastructur environ sector own poyri plc austrian verbund ag
positive,poyri recogn one world lead advisor global forestri industri
positive,precedex approv iv sedat initi intub mechan ventil patient intens care
neutral,press releas 3 septemb 2009 ruukki continu list two dow jone sustain index djsi world djsi stoxx
neutral,previous plant expect complet end 2008
neutral,product plant base nest oil proprietari technolog use flexibl input veget oil anim fat
neutral,prothiou engin wwwprothiouscom employ 1000 larg portfolio project annual detail capac 100000 tonn
neutral,qpr product famili fulli compat microsoft window 7 oper system
positive,ramir lead compani machineri equip rental construct industri
positive,ramir lead construct machineri rental compani finland annual sale eur 134 million 2009 oper nationwid 83 outlet 612 employe
